{
  "seq": 2,
  "ts": "2026-09-16T02:14:09Z",
  "kind": "step.finished",
  "prev_hash": "sha256:aeebad4a796fcc2e15dc4c6061b45ed9b373f26adfc798ca7d2d8cc58182718e",
  "hash": "sha256:690396b0e760bb1a655c81fe146dd04fdd7ed9686a1916cf90e4c223914ae917",
  "refs": {
    "tenant": "acme",
    "run_id": "run_17342",
    "step_id": "implement-change",
    "assignment_id": "asg_01J8R3K5Q2N7VX9M4T6B0DPHWE",
    "artifact_ids": [
      "art-pr-412"
    ]
  },
  "method": "worker",
  "adapter": "coding-worker-primary",
  "consumption": {
    "tokens_in": 38000,
    "tokens_out": 9500,
    "quota_units": 84
  },
  "outcome": "succeeded",
  "content_digest": "sha256:2d845c926bc9d0b2a6fc7f8775c07e0c0517bee059e6851e9ca72dd0b52cc1cf"
}
